{
    "$schema": "https://json-schema.org/draft/2020-12/schema",
    "$id": "https://github.com/codejie/flowengine/node_schema.json",
    "title": "Flow Definition",
    "description": "The Flow definition schema",
    "type": "object",
    "properties": {
        "id": {
            "type": "string"
        },
        "name": {
            "type": "string"
        },
        "description": {
            "type": "string"
        },
        "nodes": {
            "type": "array",
            "items": {
                "type": "object",
                "properties": {
                    "index": {
                        "type": "number"
                    },
                    "id": {
                        "type": "string"
                    },
                    "parameters": {
                        "type": "array",
                        "items": {
                            "type": "object",
                            "properties": {
                                "name": {
                                    "type": "string"
                                },
                                "value": {
                                    "type": "[string | number | boolean | object | array | null]"
                                }               
                            },
                            "required": ["name", "value"]
                        }
                    },
                    "actions": {
                        "type": "array",
                        "items": {
                            "type": "object",
                            "properties": {
                                "id": {
                                    "type": "string"
                                },
                                "nextNodes": {
                                    "type": "array",
                                    "items": {
                                        "type": "number"
                                    }
                                }
                            }
                        }
                    }
                },
                "required": ["index", "id"]
            }
        }
    },
    "required": ["id"]
}